[
  {
    "iso2": "AE",
    "name": {
      "supportsSingleName": false,
      "requiresFamilyName": true,
      "nameOrder": "given_family"
    },
    "address": {
      "addressLinesRecommended": 2,
      "streetAddressCentral": true
    },
    "updatedAt": "2026-06-07"
  },
  {
    "iso2": "AU",
    "name": {
      "supportsSingleName": false,
      "requiresFamilyName": true,
      "nameOrder": "given_family"
    },
    "address": {
      "addressLinesRecommended": 2,
      "streetAddressCentral": true
    },
    "updatedAt": "2026-06-07"
  },
  {
    "iso2": "BR",
    "name": {
      "supportsSingleName": false,
      "requiresFamilyName": true,
      "nameOrder": "given_family"
    },
    "address": {
      "addressLinesRecommended": 2,
      "streetAddressCentral": true
    },
    "updatedAt": "2026-06-07"
  },
  {
    "iso2": "CN",
    "name": {
      "supportsSingleName": false,
      "requiresFamilyName": true,
      "nameOrder": "family_given"
    },
    "address": {
      "addressLinesRecommended": 2,
      "streetAddressCentral": true
    },
    "updatedAt": "2026-06-07"
  },
  {
    "iso2": "DE",
    "name": {
      "supportsSingleName": false,
      "requiresFamilyName": true,
      "nameOrder": "given_family"
    },
    "address": {
      "addressLinesRecommended": 2,
      "streetAddressCentral": true
    },
    "updatedAt": "2026-06-07"
  },
  {
    "iso2": "ES",
    "name": {
      "supportsSingleName": false,
      "requiresFamilyName": true,
      "nameOrder": "given_family"
    },
    "address": {
      "addressLinesRecommended": 2,
      "streetAddressCentral": true
    },
    "updatedAt": "2026-06-07"
  },
  {
    "iso2": "FR",
    "name": {
      "supportsSingleName": false,
      "requiresFamilyName": true,
      "nameOrder": "given_family"
    },
    "address": {
      "addressLinesRecommended": 2,
      "streetAddressCentral": true
    },
    "updatedAt": "2026-06-07"
  },
  {
    "iso2": "GB",
    "name": {
      "supportsSingleName": false,
      "requiresFamilyName": true,
      "nameOrder": "given_family"
    },
    "address": {
      "addressLinesRecommended": 2,
      "streetAddressCentral": true
    },
    "updatedAt": "2026-06-07"
  },
  {
    "iso2": "HK",
    "name": {
      "supportsSingleName": false,
      "requiresFamilyName": true,
      "nameOrder": "family_given"
    },
    "address": {
      "addressLinesRecommended": 2,
      "streetAddressCentral": true
    },
    "updatedAt": "2026-06-07"
  },
  {
    "iso2": "ID",
    "name": {
      "supportsSingleName": true,
      "requiresFamilyName": false,
      "nameOrder": "given_family"
    },
    "address": {
      "addressLinesRecommended": 2,
      "streetAddressCentral": true
    },
    "updatedAt": "2026-06-07"
  },
  {
    "iso2": "IN",
    "name": {
      "supportsSingleName": true,
      "requiresFamilyName": false,
      "nameOrder": "given_family"
    },
    "address": {
      "addressLinesRecommended": 2,
      "streetAddressCentral": true
    },
    "updatedAt": "2026-06-07"
  },
  {
    "iso2": "IT",
    "name": {
      "supportsSingleName": false,
      "requiresFamilyName": true,
      "nameOrder": "given_family"
    },
    "address": {
      "addressLinesRecommended": 2,
      "streetAddressCentral": true
    },
    "updatedAt": "2026-06-07"
  },
  {
    "iso2": "JP",
    "name": {
      "supportsSingleName": false,
      "requiresFamilyName": true,
      "nameOrder": "family_given"
    },
    "address": {
      "addressLinesRecommended": 3,
      "streetAddressCentral": false
    },
    "updatedAt": "2026-06-07"
  },
  {
    "iso2": "KR",
    "name": {
      "supportsSingleName": false,
      "requiresFamilyName": true,
      "nameOrder": "family_given"
    },
    "address": {
      "addressLinesRecommended": 2,
      "streetAddressCentral": true
    },
    "updatedAt": "2026-06-07"
  },
  {
    "iso2": "MX",
    "name": {
      "supportsSingleName": false,
      "requiresFamilyName": true,
      "nameOrder": "given_family"
    },
    "address": {
      "addressLinesRecommended": 2,
      "streetAddressCentral": true
    },
    "updatedAt": "2026-06-07"
  },
  {
    "iso2": "NL",
    "name": {
      "supportsSingleName": false,
      "requiresFamilyName": true,
      "nameOrder": "given_family"
    },
    "address": {
      "addressLinesRecommended": 2,
      "streetAddressCentral": true
    },
    "updatedAt": "2026-06-07"
  },
  {
    "iso2": "SE",
    "name": {
      "supportsSingleName": false,
      "requiresFamilyName": true,
      "nameOrder": "given_family"
    },
    "address": {
      "addressLinesRecommended": 2,
      "streetAddressCentral": true
    },
    "updatedAt": "2026-06-07"
  },
  {
    "iso2": "SG",
    "name": {
      "supportsSingleName": false,
      "requiresFamilyName": true,
      "nameOrder": "given_family"
    },
    "address": {
      "addressLinesRecommended": 2,
      "streetAddressCentral": true
    },
    "updatedAt": "2026-06-07"
  },
  {
    "iso2": "TW",
    "name": {
      "supportsSingleName": false,
      "requiresFamilyName": true,
      "nameOrder": "family_given"
    },
    "address": {
      "addressLinesRecommended": 2,
      "streetAddressCentral": true
    },
    "updatedAt": "2026-06-07"
  },
  {
    "iso2": "US",
    "name": {
      "supportsSingleName": false,
      "requiresFamilyName": true,
      "nameOrder": "given_family"
    },
    "address": {
      "addressLinesRecommended": 2,
      "streetAddressCentral": true
    },
    "updatedAt": "2026-06-07"
  }
]
